country,source,author,title,description,url,urlToImage,publishedAt,content,date,sentiment,domain,is_green
sa,"{'id': None, 'name': 'Ctvnews.ca'}","The Canadian Press, By Kevin Bissett",Former N.S. Liberal candidate says she was dropped because of 'boudoir photos' - CTV News Atlantic,"A woman who was briefly a Liberal candidate in the Nova Scotia election says the party asked her to lie about why she dropped out, having her cite mental health concerns.",https://atlantic.ctvnews.ca/former-n-s-liberal-candidate-says-she-was-dropped-because-of-boudoir-photos-1.5519119,https://www.ctvnews.ca/polopoly_fs/1.5519127.1626963547!/httpImage/image.jpg_gen/derivatives/landscape_620/image.jpg,2021-07-22T14:22:00Z,"HALIFAX -- 
A woman who was briefly a Liberal candidate in the Nova Scotia election says the party asked her to lie about why she dropped out and cite mental health concerns.
Robyn Ingraham said We… [+3231 chars]",2021-07-22 14:58:52.519894,-0.332047979036967,atlantic.ctvnews.ca,0
sa,"{'id': None, 'name': 'Ctvnews.ca'}",CTVNewsVancouver.ca,COVID-19 in B.C.: Update with latest case counts coming from health ministry - CTV News Vancouver,"With B.C.'s daily average of COVID-19 case counts rising slightly, residents will get another local snapshot Thursday of how the disease is spreading in the province.",https://bc.ctvnews.ca/covid-19-in-b-c-update-with-latest-case-counts-coming-from-health-ministry-1.5519116,https://www.ctvnews.ca/polopoly_fs/1.5478638.1626200115!/httpImage/image.jpg_gen/derivatives/landscape_620/image.jpg,2021-07-22T14:17:29Z,"VANCOUVER -- 
With B.C.'s daily average of COVID-19 case counts rising slightly, residents will get another local snapshot Thursday of how the disease is spreading in the province.
A statement will… [+863 chars]",2021-07-22 14:58:52.519894,-0.4807109087705612,bc.ctvnews.ca,0
sa,"{'id': 'cbc-news', 'name': 'CBC News'}",,China uninterested in WHO plan for further COVID-19 origins study - CBC.ca,"China cannot accept the World Health Organization's plan for the second phase of a study into the origins of COVID-19, a senior Chinese health official said Thursday.",https://www.cbc.ca/news/world/china-who-covid-origins-phase2-1.6112386,https://i.cbc.ca/1.5906627.1622158495!/fileImage/httpImage/image.JPG_gen/derivatives/16x9_620/health-coronavirus-snapshot.JPG,2021-07-22T13:56:46Z,"China cannot accept the World Health Organization's plan for the second phase of a study into the origins of COVID-19, a senior Chinese health official said Thursday.
Zeng Yixin, the vice minister o… [+5150 chars]",2021-07-22 14:58:52.519894,-0.4996667206287384,www.cbc.ca,0
sa,"{'id': None, 'name': 'IndieWire'}",Ryan Lattanzio,‘Dune’ New Trailer: Timothée Chalamet and Denis Villeneuve Reveal Latest Look at Frank Herbert Epic - IndieWire,"""Dune"" is finally set to come out this fall, with a Venice world premiere on September 3 followed by wide release and HBO Max on October 22.",https://www.indiewire.com/2021/07/dune-new-trailer-timothee-chalamet-denis-villeneuve-1234653047/,https://www.indiewire.com/wp-content/uploads/2021/07/Screen-Shot-2021-07-22-at-9.05.19-AM.png?w=780,2021-07-22T13:16:28Z,"After many a pandemic delay, the release of Denis Villeneuve’s “Dune” is finally in sight. Before the movie premieres in theaters and on HBO Max October 22, the adaptation of Frank Herbert’s sprawlin… [+2358 chars]",2021-07-22 14:58:52.519894,0.9936,www.indiewire.com,0
sa,"{'id': None, 'name': 'Kitco NEWS'}",http://www.facebook.com/kitconews,Gold price holding $1800 an ounce as U.S. weekly jobless claims rise by 51K - Kitco NEWS,"(Kitco News) - The gold market continues to hold important support above $1,800 an ounce but continues to see little movement to disappointing economic data as more Americans than expected apply for first-time unemployment.",https://www.kitco.com/news/2021-07-22/Gold-price-holding-1-800-an-ounce-as-U-S-weekly-jobless-claims-rise-by-51K.html,https://www.kitco.com/news/2021-07-22/images/jobsearch-650.jpg,2021-07-22T12:43:00Z,"Editor's Note: With so much market volatility, stay on top of daily news! Get caught up in minutes with our speedy summary of today's must-read news and expert opinions. Sign up here! 
(Kitco News) … [+1242 chars]",2021-07-22 14:58:52.519894,-0.49924543499946594,www.kitco.com,0
sa,"{'id': None, 'name': 'National Post'}",Tristin Hopper,"COVID-19 myths that refuse to die, from undue concern about children to variants and vaccines - National Post",The pandemic was never a danger to children,https://nationalpost.com/health/covid-19-myths-that-refuse-to-die-from-undue-concern-about-children-to-variants-and-vaccines,https://smartcdn.prod.postmedia.digital/nationalpost/wp-content/uploads/2021/07/6668_X044_01C2_9.jpg,2021-07-22T10:31:31Z,"The pandemic was never a danger to children 
Tristin Hopper
July 6 photo of children at a playground in Philadelphia. Photo by REUTERS/Hannah Beier
Article content
If youre reading this in Canada… [+9840 chars]",2021-07-22 14:58:52.519894,0.0,nationalpost.com,1
sa,"{'id': 'cbc-news', 'name': 'CBC News'}",,"COVID-19 in Sask: 53 new cases, most new infections since restrictions lifted - CBC.ca","Saskatchewan announced 53 new cases of COVID-19 in the province on Wednesday, the most in a day since public health restrictions lifted on July 11.",https://www.cbc.ca/news/canada/saskatchewan/saskatchewan-covid-cases-update-july-21-1.6111657,https://i.cbc.ca/1.6104464.1626376389!/cumulusImage/httpImage/image.jpg_gen/derivatives/16x9_620/vaccine-walk-ins.jpg,2021-07-21T22:11:21Z,"Saskatchewan announced 53 new cases of COVID-19 in the province on Wednesday, the most in a day since public health restrictions lifted on July 11. 
The most new cases in a day this month was 114 on… [+1283 chars]",2021-07-22 14:58:52.519894,-0.03298443169593812,www.cbc.ca,0
sa,"{'id': None, 'name': 'Global News'}",joshkelliott,Jeff Bezos blasted for ‘phallic’ rocket flight into space on Blue Origin - Global News,Critics saw Bezos' spacecraft as a metaphor for his billionaire rocket-measuring contest with Elon Musk and Richard Branson.,https://globalnews.ca/news/8046983/jeff-bezos-blue-origin-rocket-launch-shape/,https://globalnews.ca/wp-content/uploads/2021/07/richard-rocket-e1626891018696.jpg?quality=85&strip=all&crop=0px%2C24px%2C1000px%2C528px&resize=720%2C379,2021-07-21T18:52:52Z,"Money can buy you a round trip to the edge of space, but it cant buy you respect on the internet or admiration from the customers and low-income workers who made your dream possible.
Amazon founder … [+5416 chars]",2021-07-22 14:58:52.519894,-0.48688915371894836,globalnews.ca,0
sa,"{'id': 'cbc-news', 'name': 'CBC News'}",,Key COVID-19 numbers in the Ottawa area today - CBC.ca,"Ottawa Public Health (OPH) reported nine more COVID-19 cases, but no deaths Wednesday. There are 25 known active cases.",https://www.cbc.ca/news/canada/ottawa/covid19-ottawa-cases-numbers-trends-july-21-1.6111123,https://i.cbc.ca/1.6110743.1626869832!/fileImage/httpImage/image.jpg_gen/derivatives/16x9_620/people-cycling-seen-in-a-puddle.jpg,2021-07-21T18:34:36Z,<ul><li>Ottawa reports nine more COVID-19 cases Wednesday.</li><li>State of emergency to end in Ottawa at 12:01 a.m. Thursday.</li><li>Zero active outbreaks of COVID-19 in Ottawa.</li></ul>Today's Ot… [+2378 chars],2021-07-22 14:58:52.519894,-0.33364995317459106,www.cbc.ca,0
sa,"{'id': None, 'name': 'BBC News'}",https://www.facebook.com/bbcnews,'Jurassic Pompeii' yields thousands of 'squiggly wiggly' fossils - BBC News,Scientists are excavating one of the most important Jurassic sites ever discovered in the UK.,https://www.bbc.com/news/science-environment-57853537,https://ichef.bbci.co.uk/news/1024/branded_news/1019E/production/_119505956_index_new.jpg,2021-07-21T05:12:30Z,"By Jonathan AmosBBC Science Correspondent
image captionFrozen in time: Fossilised seafloor animals from the Jurassic, all piled on top of each other
""If they could squeal, I'm sure they would have … [+9776 chars]",2021-07-22 14:58:52.519894,0.49925,www.bbc.com,1
sg,"{'id': None, 'name': 'CNA'}",Ng Hong Siang,"COVID-19 cases detected at 35 markets and food centres so far, linked to fishery port cluster: MOH - CNA","SINGAPORE: COVID-19 cases have been detected in at least 35 markets and food centres linked to the growing Jurong Fishery Port cluster, said the Ministry of Health (MOH) on Tuesday (Jul 20).",https://www.channelnewsasia.com/news/singapore/covid-19-cases-detected-35-markets-moh-jurong-port-cluster-15256588,"https://cna-sg-res.cloudinary.com/image/upload/q_auto,f_auto/image/15240582/16x9/991/557/f1e0bdc66f4ab805b6e0cc85c2b04b5a/vw/chong-boon-market.png",2021-07-22T17:50:06Z,"SINGAPORE: COVID-19 cases have been detected in at least 35 markets and food centres linked to the growing Jurong Fishery Port cluster, said the Ministry of Health (MOH) on Tuesday (Jul 20). 
Accord… [+2698 chars]",2021-07-22 14:58:52.519894,-0.9522183239459991,www.channelnewsasia.com,0
sg,"{'id': None, 'name': 'The Straits Times'}",ISABELLE LIEW,Boon Lay Place Food Village to shut till Aug 6 after 7 Covid-19 cases found - The Straits Times,"There were also five more cases added to the Marina Bay Sands Casino cluster, which now has 15 cases.. Read more at straitstimes.com.",https://www.straitstimes.com/singapore/health/boon-lay-place-food-village-to-shut-till-aug-6-after-7-covid-19-cases-found,https://static.straitstimes.com.sg/s3fs-public/styles/x_large/public/articles/2021/07/23/yuboonlaymbscoll0722.jpg?itok=HnGeWehF,2021-07-22T16:16:10Z,"SINGAPORE - Boon Lay Place Food Village will be closed after seven Covid-19 cases were detected among people who work in or visited the hawker centre, said the Ministry of Health (MOH).
In its daily… [+2624 chars]",2021-07-22 14:58:52.519894,-0.4921135902404785,www.straitstimes.com,0
sg,"{'id': None, 'name': 'Dexerto'}",,Activision Blizzard “disaster” behind Warcraft III Reforged revealed by devs - Dexerto,"Warcraft III Reforged devs have spoken out about the development of the game, citing mismanagement as the reason for it's failures.",https://www.dexerto.com/gaming/activision-blizzard-disaster-behind-warcraft-iii-reforged-revealed-by-devs-1616790/,https://www.dexerto.com/wp-content/uploads/2021/07/22/warcraft-3-reforged-devs-slam-activision-blizzard-1.jpeg,2021-07-22T15:40:04Z,"Developers at Activision Blizzard behind the now-notorious Warcraft III: Reforged have spoken out about their treatment, and the “mismanagement” that led to the game’s disappointing launch. 
On July… [+2147 chars]",2021-07-22 14:58:52.519894,-0.999163955450058,www.dexerto.com,1
sg,"{'id': None, 'name': 'CNA'}",,Attractions can consider letting in only COVID-19 vaccinated visitors: Expert | Video - CNA,"An infectious diseases expert tells CNA that attractions could consider letting in only vaccinated visitors to prevent clusters from seeding in crowded, interactive settings. This comes as Marina Bay Sands shut its casino until Aug 5 after a cluster emerged o…",https://www.channelnewsasia.com/news/singapore/attractions-can-consider-letting-in-only-covid-19-vaccinated-15271580,https://cf-images.ap-southeast-1.prod.boltdns.net/v1/static/6057994443001/2659d936-57a2-4121-9ed2-32034923c8f2/9e446115-be71-42b1-bbe6-48f5d7f5bed4/640x360/match/image.jpg,2021-07-22T14:52:40Z,"meREWARDS lets you get coupon deals, and earn cashback when you complete surveys, dine, travel and shop with our partners",2021-07-22 14:58:52.519894,-0.6404644052187601,www.channelnewsasia.com,0
sg,"{'id': None, 'name': 'Yahoo Entertainment'}",Reuters Videos,NASA's Mars rover to begin hunt for signs of life - Yahoo Singapore News,NASA’s hunt for signs of ancient life on Mars has begun.The six-wheeled rover Perseverance landed safely on the Red Planet in February 2021.Now it's finally ...,https://sg.news.yahoo.com/nasas-mars-rover-begin-hunt-143241339.html,https://s.yimg.com/hd/cp-video-transcode/prod/2021-07/22/60f9837c540ba326483ac68f/60f9837c540ba326483ac690_o_U_v2.jpg,2021-07-22T14:32:41Z,"NASAs hunt for signs of ancient life on Mars has begun.
The six-wheeled rover Perseverance landed safely on the Red Planet in February 2021.
Now it's finally ready to start taking samples from the … [+2634 chars]",2021-07-22 14:58:52.519894,0.4992,sg.news.yahoo.com,0
sg,"{'id': None, 'name': 'Yahoo Entertainment'}",Jon Fingas,Spotify and Giphy are 'enhancing' GIFs with music - Yahoo Singapore News,Spotify and Giphy now give you a way to 'listen' to GIFs by pointing you to a musician's Spotify page.,https://sg.news.yahoo.com/spotify-giphy-gif-music-142927089.html,https://s.yimg.com/os/creatr-uploaded-images/2021-07/1651f890-eaf5-11eb-adb7-389f06adfb22,2021-07-22T14:29:27Z,Have you ever seen a musician's GIF and heard the song in your head? You won't have to leave things to the imagination for much longer. Spotify and Giphy have partnered to effectively give GIFs a sou… [+761 chars],2021-07-22 14:58:52.519894,0.0,sg.news.yahoo.com,0
sg,"{'id': None, 'name': 'TODAYonline'}",,"NDP postponed to Aug 21, ceremonial parade to be held on Aug 9 instead: Mindef - TODAYonline",SINGAPORE — The National Day Parade (NDP) this year will be postponed to Aug 21 after the end of Phase 2 (heightened alert) measures to curb the spread of Covid-19 in Singapore.,https://www.todayonline.com/singapore/ndp-postponed-aug-21-ceremonial-parade-be-held-aug-9-instead-mindef,https://www.todayonline.com/sites/default/files/styles/new_app_article_detail/public/photos/43_images/raj_ndp12_720.jpg?itok=lrpPAvQS,2021-07-22T14:10:25Z,,2021-07-22 14:58:52.519894,-0.9971705675125122,www.todayonline.com,0
sg,"{'id': 'techradar', 'name': 'TechRadar'}",Henry St Leger,Sony A90J OLED vs Sony X90J: which 4K TV is best for you? - Techradar,How to choose your favorite 2021 Sony TV,https://www.techradar.com/news/sony-x90j-vs-sony-a90j-oled,https://cdn.mos.cms.futurecdn.net/z2RANLNpptNxbcHRfHQbTg-1200-80.jpg,2021-07-22T14:00:20Z,"The Sony X90J and Sony A90J OLED are two high-spec 4K TVs for 2021 but which one should you actually take home with you? Having had the pleasure of testing out both televisions, we can say confidentl… [+5733 chars]",2021-07-22 14:58:52.519894,-0.09405301094055174,www.techradar.com,1
sg,"{'id': None, 'name': 'CNA'}",CNA,"15 men investigated for illegal horse betting activities in Ang Mo Kio, Rivervale Crescent - CNA","SINGAPORE: Fifteen men, aged between 50 and 70, are being investigated for their suspected involvement in illegal horse betting activities in public locations, the police said on Thursday (Jul 22).",https://www.channelnewsasia.com/news/singapore/15-men-illegal-horse-betting-ang-mo-kio-rivervale-crescent-15271024,"https://cna-sg-res.cloudinary.com/image/upload/q_auto,f_auto/image/10855114/16x9/991/557/5d8fd28fe5a1869163de0c312c585571/FF/police-03.jpg",2021-07-22T13:09:02Z,"SINGAPORE: Fifteen men, aged between 50 and 70, are being investigated for their suspected involvement in illegal horse betting activities in public locations, the police said on Thursday (Jul 22).
… [+1191 chars]",2021-07-22 14:58:52.519894,-0.9517276883125305,www.channelnewsasia.com,0
sg,"{'id': None, 'name': 'The Online Citizen'}",,"Auditor-General Office detects housing grants given to ineligible applicants, possible irregularities in quotations by HDB - The Online Citizen Asia","The Online Citizen Asia Auditor-General Office detects housing grants given to ineligible applicants, possible irregularities in quotations by HDB",https://www.theonlinecitizen.com/2021/07/22/auditor-general-office-detects-housing-grants-given-to-ineligible-applicants-possible-irregularities-in-quotations-by-hdb/,https://www.theonlinecitizen.com/wp-content/uploads/2021/07/ago-hdb.jpg,2021-07-22T12:04:12Z,The Auditor-General Office (AGO) has released its auditing report on government ministries and statutory boards for the year 2020/2021 on Thursday (22 July) and has flagged a number of lapses concern… [+6377 chars],2021-07-22 14:58:52.519894,-0.9914298951625824,www.theonlinecitizen.com,1
sg,"{'id': None, 'name': 'CNA'}",CNA,"As Indonesia mulls easing COVID-19 lockdown, WHO urges tougher restrictions - CNA","The World Health Organization (WHO) on Thursday urged Indonesia to implement a stricter and wider lockdown to combat surging COVID-19 infections and deaths, just days after the country's  president flagged the easing of restrictions.",https://www.channelnewsasia.com/news/asia/as-indonesia-mulls-easing-covid-19-lockdown-who-urges-tougher-15268624,"https://cna-sg-res.cloudinary.com/image/upload/q_auto,f_auto/image/15268622/16x9/991/557/e8798ff7bf304e48d57d750319454906/UV/amid-a-surge-of-coronavirus-disease--covid-19--cases-in-surabaya-5.jpg",2021-07-22T11:52:28Z,"JAKARTA: The World Health Organization (WHO) on Thursday (Jul 22) urged Indonesia to implement a stricter and wider lockdown to combat surging COVID-19 infections and deaths, just days after the coun… [+2600 chars]",2021-07-22 14:58:52.519894,0.0,www.channelnewsasia.com,0
sg,"{'id': None, 'name': 'The Straits Times'}",GRACE HO,Consider minimum wage as a complement to progressive wage model: MAS chief - The Straits Times,"SINGAPORE - The Republic may want to seriously study a modest minimum wage as a complement to the existing progressive wage model (PWM), said Singapore's central bank chief on Thursday (July 22).. Read more at straitstimes.com.",https://www.straitstimes.com/singapore/politics/consider-minimum-wage-as-a-complement-to-progressive-wage-model-mas-chief,https://www.straitstimes.com/sites/all/themes/custom/bootdemo/images/facebook_default_pic_new.jpg,2021-07-22T10:10:00Z,"SINGAPORE - The Republic may want to seriously study a modest minimum wage as a complement to the existing progressive wage model (PWM), said Singapore's central bank chief on Thursday (July 22). 
H… [+7012 chars]",2021-07-22 14:58:52.519894,-0.48812875151634216,www.straitstimes.com,0
sg,"{'id': None, 'name': 'AsiaOne'}",,Mark Lee plays Xiang Yun's boyfriend in CNY movie Reunion Dinner: 'I'll ask Edmund Chen if we can have intimate scenes' - AsiaOne,"Despite the ongoing Covid-19 pandemic, Singapore will still get its homegrown Chinese New Year movie next year, continuing a much beloved tradition. This morning (July 22), the cast and director of local film Reunion Dinner held a press conference to mark the…",https://www.asiaone.com/entertainment/mark-lee-xiang-yun-boyfriend-cny-2022-movie-reunion-dinner-lawrence-wong,https://media.asiaone.com/sites/default/files/styles/a1_600x316/public/original_images/Jul2021/20210722_rdmain.jpg?h=00f526df&itok=O9_9prTb,2021-07-22T09:28:00Z,"Despite the ongoing Covid-19 pandemic, Singapore will still get its homegrown Chinese New Year movie next year, continuing a much beloved tradition.
This morning (July 22), the cast and director of … [+3339 chars]",2021-07-22 14:58:52.519894,0.08759382479985556,www.asiaone.com,0
sg,"{'id': None, 'name': 'CNA'}",Ahmad Zhaki Abdullah,"NTU researchers develop 'safer, cheaper' bicycle helmets - CNA",SINGAPORE: Researchers from Nanyang Technological University (NTU) have developed a cycling helmet that they say will reduce the chances of critical injury to the wearer.,https://www.channelnewsasia.com/news/singapore/ntu-researchers-safer-bicycle-helmets-elium-15268514,"https://cna-sg-res.cloudinary.com/image/upload/q_auto,f_auto/image/15268516/16x9/991/557/496a9a2b88327bc5c8e501cefba44fd0/fo/ntu-helmet-research.jpg",2021-07-22T09:19:29Z,"SINGAPORE: Researchers from Nanyang Technological University (NTU) have developed a cycling helmet that they say will reduce the chances of critical injury to the wearer.
Not only is this helmet - m… [+5356 chars]",2021-07-22 14:58:52.519894,-0.48287537693977356,www.channelnewsasia.com,0
sg,"{'id': None, 'name': 'TODAYonline'}",,Employers required to give maids at least 1 rest day a month from end-2022; cannot be compensated away: MOM - TODAYonline,"SINGAPORE — From the end of 2022, employers will be required to give their domestic workers at least one rest day a month that cannot be compensated away, the Ministry of Manpower (MOM) said on Thursday (July 22).",https://www.todayonline.com/singapore/employers-required-give-maids-least-1-rest-day-month-end-2022-cannot-be-compensated-away,https://www.todayonline.com/sites/default/files/styles/new_app_article_detail/public/photos/43_images/20210502_bk_domestic_worker_br_9_generic_1.jpg?itok=gthIC2RF,2021-07-22T09:13:27Z,,2021-07-22 14:58:52.519894,-0.9749654233455658,www.todayonline.com,0
sg,"{'id': None, 'name': 'Yahoo Entertainment'}","Staff Writer, Singapore","AGO report flags $5.4m wasted by HPB on fitness trackers, other lapses - Yahoo Singapore News","An excess of 341,000 fitness trackers were purchased for the National Steps Challenge, resulting in the wastage of $5.39 million by the Health Promotion...",https://sg.news.yahoo.com/hpb-wasted-millions-excess-fitness-trackers-overpayment-psd-ago-085643957.html,https://s.yimg.com/ny/api/res/1.2/SI5FZsWV5seFyF0X9VavGg--/YXBwaWQ9aGlnaGxhbmRlcjt3PTIwMDA7aD0xMzMz/https://s.yimg.com/os/creatr-uploaded-images/2021-07/19994710-eac3-11eb-bfd6-08887665c701,2021-07-22T08:56:43Z,"People sitting next to a pond with the view of Singapore's CBD skyline in the background. (PHOTO: Getty Images)
SINGAPORE An excess of 341,000 fitness trackers were purchased for the National Steps … [+4944 chars]",2021-07-22 14:58:52.519894,-0.49985843896865845,sg.news.yahoo.com,0
sg,"{'id': None, 'name': 'CNA'}",CNA,All 14 workers lost in tunnel flood in China confirmed dead - CNA,"The bodies of all 14 workers trapped when a tunnel under construction was flooded last week have been recovered, authorities in southern China said on Thursday (Jul 22).",https://www.channelnewsasia.com/news/asia/14-tunnel-workers-china-tunnel-flood-zhuhai-guangdong-province-15268664,"https://cna-sg-res.cloudinary.com/image/upload/q_auto,f_auto/image/15268660/16x9/991/557/90bb3fa9c72e73b6cd95d3cc0d771a9b/MH/china-tunnel-flood-61568-jpg-1626936969.jpg",2021-07-22T08:37:53Z,"BEIJING: The bodies of all 14 workers trapped when a tunnel under construction was flooded last week have been recovered, authorities in southern China said on Thursday (Jul 22).
A brief statement o… [+1936 chars]",2021-07-22 14:58:52.519894,-0.9883378744125366,www.channelnewsasia.com,0
sg,"{'id': None, 'name': 'The Online Citizen'}",,Netizens question why Ong Ye Kung appears to shift blame from KTV cluster to Jurong Fishery Port cluster - The Online Citizen Asia,The Online Citizen Asia Netizens question why Ong Ye Kung appears to shift blame from KTV cluster to Jurong Fishery Port cluster Health,https://www.theonlinecitizen.com/2021/07/22/netizens-question-why-ong-ye-kung-appears-to-shift-blame-from-ktv-cluster-to-jurong-fishery-port-cluster/,https://www.theonlinecitizen.com/wp-content/uploads/2021/05/ong-ye-kung.png,2021-07-22T08:28:33Z,"A possible “uncontrollable rise” of COVID-19 cases from the Jurong Fishery Port cluster is behind the Government’s decision to revert to a tightening of measures under Phase 2 (Heightened Alert), sai… [+6331 chars]",2021-07-22 14:58:52.519894,0.0,www.theonlinecitizen.com,1
sg,"{'id': None, 'name': 'TODAYonline'}",,"Mandatory Covid-19 testing for residents, workers at 4 HDB blocks in Sims Avenue after viral fragments found in wastewater samples - TODAYonline",SINGAPORE — Residents and workers at four blocks of Housing and Development Board (HDB) flats along Sims Avenue will undergo mandatory testing for Covid-19 after viral fragments were detected in wastewater samples collected from the blocks.,https://www.todayonline.com/singapore/mandatory-covid-testing-residents-workers-4-hdb-blocks-sims-avenue-viral-fragments-wastewater-samples,https://www.todayonline.com/sites/default/files/styles/new_app_article_detail/public/photos/43_images/sims_ave.png?itok=QO8qdwdv,2021-07-22T06:46:20Z,,2021-07-22 14:58:52.519894,0.0,www.todayonline.com,0
sg,"{'id': None, 'name': 'Yahoo Entertainment'}",Jing Xuan TENG,China says WHO plan to audit labs in Covid origins probe 'arrogant' - Yahoo Singapore News,"China on Thursday said a WHO proposal to audit Chinese labs as part of further investigation into the origins of the coronavirus pandemic showed ""disrespect""...",https://sg.news.yahoo.com/china-says-plan-audit-labs-054811187.html,https://s.yimg.com/uu/api/res/1.2/PhsoRyqB6iDWWs0FZjc4QQ--~B/aD03MjE7dz03Njg7YXBwaWQ9eXRhY2h5b24-/https://media.zenfs.com/en/afp.com.sg/335d8ad4d082bc3123166ea38d934c34,2021-07-22T05:48:11Z,"China on Thursday said a WHO proposal to audit Chinese labs as part of further investigation into the origins of the coronavirus pandemic showed ""disrespect"" and ""arrogance towards science"".
Last we… [+3060 chars]",2021-07-22 14:58:52.519894,-0.49975675344467163,sg.news.yahoo.com,0
sg,"{'id': None, 'name': 'The Straits Times'}",JOHN LUI,Major cinema chains in S'pore ready to return to tighter Covid-19 curbs - The Straits Times,Cinemas had only just restarted food and drink sales.. Read more at straitstimes.com.,https://www.straitstimes.com/singapore/major-cinema-chains-ready-to-return-tophase-two-heightened-alert-curbs,https://static.straitstimes.com.sg/s3fs-public/styles/x_large/public/articles/2021/07/22/eb-cinema-072221.jpg?itok=L3dMGGF5,2021-07-22T05:47:24Z,"SINGAPORE - Three major cinema chains have told The Straits Times that they are ready to return to the phase two (heightened alert) measures from Thursday (July 22), with some stating their disappoin… [+3721 chars]",2021-07-22 14:58:52.519894,-0.996716320514679,www.straitstimes.com,0
