country,source,author,title,description,url,urlToImage,publishedAt,content,date,sentiment,domain,is_green
my,"{'id': None, 'name': 'The Sun Daily'}",,Selayang Hospital third in Selangor to be turned into full Covid-19 hospital - The Sun Daily,KUALA LUMPUR: The status of Selayang Hospital has changed from hybrid Covid-19 hospital to full Covid-19 hospital effective yesterday. The matter was ...,https://www.thesundaily.my/local/selayang-hospital-third-in-selangor-to-be-turned-into-full-covid-19-hospital-EB8102767,https://www.thesundaily.my/binrepository/512x250/16c0/480d250/none/11808/QCGY/selayanhospital-facebook_1797043_20210722171646.jpg,2021-07-22T09:16:00Z,"KUALA LUMPUR: The status of Selayang Hospital has changed from hybrid Covid-19 hospital to full Covid-19 hospital effective yesterday.
The matter was announced through status updates on the hospital… [+310 chars]",2021-07-22 14:58:52.519894,-0.5080275336901346,www.thesundaily.my,0
my,"{'id': None, 'name': 'Malaysiakini'}",Malaysiakini Team,Contract doctors to proceed with strike after no resolution from govt - Malaysiakini,Participants have asked hospitals to seek a replacement for them during the one-day strike on July 26.,https://www.malaysiakini.com/news/584037,https://icf.newscdn.net/publisher-c1a3f893382d2b2f8a9aa22a654d9c97/2020/03/76df61e27205c3de5ba39de78a424436.jpg,2021-07-22T05:36:00Z,"A group of government contract doctors will proceed with a strike on July 26 as Putrajaya has yet to offer a resolution to their woes.
Health Minister Dr Adham Baba had on July 12 said a resolution … [+173 chars]",2021-07-22 14:58:52.519894,0.0,www.malaysiakini.com,1
my,"{'id': None, 'name': 'The Star Online'}",AGENCY,Hong Kong artiste Daniel Chan avoids showering after Covid-19 jab - The Star Online,The China-based singer is currently in Beijing and had just taken his first jab.,https://www.thestar.com.my/lifestyle/entertainment/2021/07/22/hong-kong-artiste-daniel-chan-avoids-showering-after-covid-19-vaccination,https://apicms.thestar.com.my/uploads/images/2021/07/22/1229156.jpg,2021-07-22T04:50:00Z,"Hong Kong singer-actor Daniel Chan has told his fans he would not bathe for a day after getting his Covid-19 vaccination.Chan, 45, known for hit songs such as The Heart Already Knows and Happier Than… [+861 chars]",2021-07-22 14:58:52.519894,-0.2841900587081909,www.thestar.com.my,0
my,"{'id': None, 'name': 'The Star Online'}",The Star Online,Tokyo Olympics fires ceremony director over 1998 Holocaust joke - The Star Online,"TOKYO (Bloomberg): The Tokyo Olympics faced the latest in a series of PR disasters when they were forced to fire the director of the opening ceremony a day before it takes place, after a decades-old video emerged of him joking about the Holocaust.",https://www.thestar.com.my/aseanplus/aseanplus-news/2021/07/22/tokyo-olympics-fires-ceremony-director-over-1998-holocaust-joke,https://apicms.thestar.com.my/uploads/images/2021/07/22/1228931.jpg,2021-07-22T04:50:00Z,"TOKYO (Bloomberg): The Tokyo Olympics faced the latest in a series of PR disasters when they were forced to fire the director of the opening ceremony a day before it takes place, after a decades-old … [+2126 chars]",2021-07-22 14:58:52.519894,-0.4993268549442291,www.thestar.com.my,0
my,"{'id': None, 'name': 'Chron.com'}",CANDICE CHOI,What is a COVID-19 vaccine 'breakthrough' case? - Chron,"What is a COVID-19 vaccine ""breakthrough"" case?",https://www.chron.com/news/article/What-is-a-COVID-19-vaccine-breakthrough-case-16331365.php,https://s.hdnux.com/photos/01/21/07/36/21264287/3/rawImage.jpg,2021-07-22T04:07:06Z,It’s when a fully vaccinated person gets infected with the coronavirus. A small number of such cases are expected and health officials say they're not a cause for alarm.COVID-19 vaccines work by teac… [+2216 chars],2021-07-22 14:58:52.519894,0.0,www.chron.com,0
my,"{'id': None, 'name': 'The Straits Times'}",RAM ANAND,Malaysia's ex-minister Syed Saddiq charged with criminal breach of trust - The Straits Times,"He was accused of misappropriating RM1 million (S$323,070) of funds from PM Muhyiddin's Bersatu party.. Read more at straitstimes.com.",https://www.straitstimes.com/asia/se-asia/malaysias-ex-minister-syed-saddiq-charged-with-criminal-breach-of-trust,https://www.straitstimes.com/s3/files/styles/x_large/public/articles/2021/07/22/ak_ss_220721.jpg?itok=0HCcALXa,2021-07-22T01:47:26Z,"KUALA LUMPUR - Malaysia's ex-minister Syed Saddiq Abdul Rahman, who was the youngest Cabinet member in the country's history, was charged on Thursday (July 22) with misappropriating RM1 million (S$32… [+3621 chars]",2021-07-22 14:58:52.519894,-0.9923800826072693,www.straitstimes.com,0
my,"{'id': None, 'name': 'Daily Mail'}",Max Winters,Manchester United 'enter talks with Real Madrid over a deal for Raphael Varane' - Daily Mail,Ole Gunnar Solskjaer is desperate to bring in a new centre back to play alongside Harry Maguire as the Red Devils try and put together a Premier League title challenge next season.,https://www.dailymail.co.uk/sport/football/article-9812343/Manchester-United-enter-talks-Real-Madrid-deal-Raphael-Varane.html,https://i.dailymail.co.uk/1s/2021/07/22/01/45740223-0-image-a-36_1626912181685.jpg,2021-07-22T00:03:17Z,"Manchester United have reportedly entered talks with Real Madrid over a deal to bring defender Raphael Varane to Old Trafford this summer.
Ole Gunnar Solskjaer is desperate to bring in a new centre … [+2376 chars]",2021-07-22 14:58:52.519894,-0.008618681859970112,www.dailymail.co.uk,0
my,"{'id': None, 'name': 'The Star Online'}",The Star Online,Producer charged with making film without licence - The Star Online,PETALING JAYA: The producer of the controversial film titled Babi was charged in the Magistrate’s Court here with participating in film-making and displaying posters without a licence from the National Film Development Corporation Mal­aysia (Finas).,https://www.thestar.com.my/news/nation/2021/07/22/producer-charged-with-making-film-without-licence,https://apicms.thestar.com.my/uploads/images/2021/07/22/1228757.jpg,2021-07-22T00:02:28Z,PETALING JAYA: The producer of the controversial film titled Babi was charged in the Magistrates Court here with participating in film-making and displaying posters without a licence from the Nationa… [+522 chars],2021-07-22 14:58:52.519894,-0.4955809414386749,www.thestar.com.my,0
my,"{'id': None, 'name': 'CNA'}",CNA,Taliban seem to have 'strategic momentum' in Afghanistan: Top US general - CNA,"The Taliban appear to have the ""strategic momentum"" in their sweeping offensives across Afghanistan, but their victory is far from assured, the chairman of the US joint chiefs of staff General Mark Milley said Wednesday.",https://www.channelnewsasia.com/news/world/taliban-seem-to-have-strategic-momentum-in-afghanistan-top-us-15264932,"https://cna-sg-res.cloudinary.com/image/upload/q_auto,f_auto/image/15264930/16x9/991/557/78c3f4f692de57420a87fef7b5c2dbf0/xi/afghan-security-personnel-on-alert-during-the-eid-al-adha-prayers-in-herat-on-july-20-2021-1626895205523-4.jpg",2021-07-21T23:19:19Z,"WASHINGTON: The Taliban appear to have the ""strategic momentum"" in their sweeping offensives across Afghanistan, but their victory is far from assured, the chairman of the US joint chiefs of staff Ge… [+4229 chars]",2021-07-22 14:58:52.519894,-0.15680576658248901,www.channelnewsasia.com,0
my,"{'id': None, 'name': 'The Star Online'}",RAJES PAUL,Chef de mission Chong Wei stays connected to team - The Star Online,"PETALING JAYA: Badminton legend Datuk Lee Chong Wei has smashed his way to many firsts in his career as a player. As an administrator, he has now become the first chef de mission of the Malaysian contingent to work from home.",https://www.thestar.com.my/sport/badminton/2021/07/22/chef-de-mission-chong-wei-stays-connected-to-team,https://apicms.thestar.com.my/uploads/images/2021/07/22/1228723.jpg,2021-07-21T23:12:46Z,"PETALING JAYA: Badminton legend Datuk Lee Chong Wei has smashed his way to many firsts in his career as a player. As an administrator, he has now become the first chef de mission of the Malaysian con… [+3303 chars]",2021-07-22 14:58:52.519894,0.016630921173095687,www.thestar.com.my,0
my,"{'id': None, 'name': 'Daily Mail'}",Adam Shergold,Manchester United have a BIG dilemma as Paul Pogba enters the final year of his contract - Daily Mail,Pogba is now into the final year of his United contract and doesn't look likely to sign another one. So the club faces a dilemma - sell this summer and recoup some money or risk losing him for nothing next year.,https://www.dailymail.co.uk/sport/football/article-9809793/Manchester-United-BIG-dilemma-Paul-Pogba-enters-final-year-contract.html,https://i.dailymail.co.uk/1s/2021/07/21/10/45709671-0-image-a-2_1626859969736.jpg,2021-07-21T21:00:46Z,"Manchester United appear happy to spend big this summer to transform themselves back into genuine challengers for the major honours.
Jadon Sancho's £73million arrival is set to be confirmed and atte… [+8587 chars]",2021-07-22 14:58:52.519894,-0.6649541854858398,www.dailymail.co.uk,0
my,"{'id': None, 'name': 'EarthSky'}",,"Jupiter at opposition August 19-20, now at its best - EarthSky","Get your telescope out now for a look at the giant planet Jupiter at opposition, coming up on August 19-20, as Earth flies between the sun and Jupiter.",https://earthsky.org/astronomy-essentials/jupiter-at-opposition-closest-brightest-best/,https://earthsky.org/upl/2021/08/jupiter-and-io-Michael-Teoh-Penang-Malaysia-Jul17-2021-e1626826073449.jpg,2021-07-21T10:19:25Z,"View at EarthSky Community Photos. | Jupiter is best through a telescope around the time of its opposition … in other words, now! Michael Teoh in Penang, Malaysia captured this image of the giant pla… [+5928 chars]",2021-07-22 14:58:52.519894,0.13846741623878478,earthsky.org,1
my,"{'id': None, 'name': 'Phys.Org'}",Natalie Handel,Fossil reveals burrowing lifestyle of tiny dino - Phys.org,"A finger-sized fossil from  308 million years ago unearthed in the United States gives tantalizing clues to the habits of tiny dinosaur-like creatures that may be the forerunners of reptiles, researchers revealed Wednesday.",https://phys.org/news/2021-07-fossil-reveals-burrowing-lifestyle-tiny.html,https://scx2.b-cdn.net/gfx/news/2021/microsaurs-are-a-group.jpg,2021-07-21T07:33:26Z,"A finger-sized fossil from 308 million years ago unearthed in the United States gives tantalizing clues to the habits of tiny dinosaur-like creatures that may be the forerunners of reptiles, research… [+3687 chars]",2021-07-22 14:58:52.519894,0.84055,phys.org,0
my,"{'id': None, 'name': 'The Star Online'}",The Star Online,Solemn mood at Singapore school following killing of student - The Star Online,"SINGAPORE (The Straits Times/ANN): The mood in River Valley High School was solemn as students returned on Wednesday (July 21), two days after the alleged murder of a 13-year-old student on campus.",https://www.thestar.com.my/aseanplus/aseanplus-news/2021/07/21/solemn-mood-at-singapore-school-following-killing-of-student,https://apicms.thestar.com.my/uploads/images/2021/07/21/1227654.jpg,2021-07-21T03:22:00Z,"SINGAPORE (The Straits Times/ANN): The mood in River Valley High School was solemn as students returned on Wednesday (July 21), two days after the alleged murder of a 13-year-old student on campus.
… [+1882 chars]",2021-07-22 14:58:52.519894,-0.9877317845821381,www.thestar.com.my,0
ng,"{'id': None, 'name': 'Daily Post Nigeria'}",Ochogwu Sunday,BREAKING: Igboho remains in Cotonou cell as court adjourns hearing - Daily Post Nigeria,"The embattled Yoruba Nation freedom fighter, Sunday Adeyemo, popularly known as Sunday Igboho, has been returned to cell in Benin Republic. The development followed the decision of the Court D’Appeal in Cotouno to adjourn the hearing on his extradition to Fri…",https://dailypost.ng/2021/07/22/igboho-remains-in-cotonou-cell-as-court-adjourns-hearing/,https://dailypost.ng/wp-content/uploads/2021/07/Sunday-Igboho-3-1280x720-1.jpg,2021-07-22T20:30:09Z,"The embattled Yoruba Nation freedom fighter, Sunday Adeyemo, popularly known as Sunday Igboho, has been returned to cell in Benin Republic.
The development followed the decision of the Court DAppeal… [+387 chars]",2021-07-22 14:58:52.519894,-0.19040163358052573,dailypost.ng,1
ng,"{'id': None, 'name': 'Phys.Org'}",Science X staff,New study provides clues to decades-old mystery about cell movement - Phys.org,"A new study, led by University of Minnesota Twin Cities engineering researchers, shows that the stiffness of protein fibers in tissues, like collagen, are a key component in controlling the movement of cells. The groundbreaking discovery provides the first pr…",https://phys.org/news/2021-07-clues-decades-old-mystery-cell-movement.html,https://scx2.b-cdn.net/gfx/news/2021/new-study-provides-clu.jpg,2021-07-22T19:28:31Z,"A new study, led by University of Minnesota Twin Cities engineering researchers, shows that the stiffness of protein fibers in tissues, like collagen, are a key component in controlling the movement … [+4594 chars]",2021-07-22 14:58:52.519894,0.39785072444279984,phys.org,0
ng,"{'id': None, 'name': 'CNBC'}",Greg Iacurci,"States cutting unemployment benefits didn't get people back to work, study finds - CNBC","People who lost federal unemployment benefits didn't rush to accept jobs in the weeks after state cuts, according to a new analysis.",https://www.cnbc.com/2021/07/22/cuts-to-unemployment-benefits-didnt-get-people-back-to-work-study-finds.html,https://image.cnbcfm.com/api/v1/image/106908326-1625763223166-gettyimages-1233630056-JOBLESS_CLAIMS.jpeg?v=1626978739,2021-07-22T19:25:43Z,"A job seeker fills out an application form during a restaurant and hospitality career fair in Torrance, California, on June 23, 2021.
State withdrawals from pandemic-era unemployment programs aren't… [+5256 chars]",2021-07-22 14:58:52.519894,-0.8022061288356781,www.cnbc.com,0
ng,"{'id': None, 'name': 'Daily Post Nigeria'}",Seun Opejobi,"Leave Nnamdi Kanu, IPOB alone – Pro-Biafra group warns Reuben Abati - Daily Post Nigeria","The Indigenous People of Biafra, IPOB, has warned a former presidential aide, Reuben Abati to stay off its affairs and leader, Nnamdi Kanu. IPOB warned that Abati would soon destroy him for interfering in its activities and that of Kanu. Emma Powerful, spokes…",https://dailypost.ng/2021/07/22/leave-nnamdi-kanu-ipob-alone-pro-biafra-group-warns-reuben-abati/,https://dailypost.ng/wp-content/uploads/2021/06/Reuben-Abati.jpg,2021-07-22T19:13:43Z,"The Indigenous People of Biafra, IPOB, has warned a former presidential aide, Reuben Abati to stay off its affairs and leader, Nnamdi Kanu.
IPOB warned that Abati would soon destroy him for interfer… [+1286 chars]",2021-07-22 14:58:52.519894,0.249875,dailypost.ng,1
ng,"{'id': None, 'name': 'Daily Post Nigeria'}",Ifreke Inyang,"2023: Tinubu could emerge APC’s consensus presidential candidate – VON DG, Okechukwu - Daily Post Nigeria","Osita Okechukwu, the Director-General of Voice of Nigeria, VON, has said the National Leader of the All Progressives Congress (APC), Asiwaju Bola Tinubu, would be in pole position to clinch the presidential ticket of the party under consensus arrangement for …",https://dailypost.ng/2021/07/22/2023-tinubu-could-emerge-apcs-consensus-presidential-candidate-von-dg-okechukwu/,https://dailypost.ng/wp-content/uploads/2020/11/Osita-Okechukwu.jpg,2021-07-22T19:01:47Z,"Osita Okechukwu, the Director-General of Voice of Nigeria, VON, has said the National Leader of the All Progressives Congress (APC), Asiwaju Bola Tinubu, would be in pole position to clinch the presi… [+1317 chars]",2021-07-22 14:58:52.519894,0.0,dailypost.ng,1
ng,"{'id': None, 'name': 'Football365.com'}",Jason Soutar,German club chief deals Chelsea a blow in their striker search - Football365,"Chelsea are prioritising Haaland, but they have been forced to think of alternatives in case they can't agree a deal for him.",https://www.football365.com/news/german-club-chief-deals-chelsea-blow-striker-search,https://d2x51gyc4ptf2q.cloudfront.net/content/uploads/2021/07/22193946/Sasa-Kalajdzic-Chelsea-F365.jpg,2021-07-22T18:46:09Z,"VfB Stuttgart sporting director Sven Mislintat has dealt a blow to Chelsea’s transfer plans as they pursue a new striker this summer.
With the Blues prioritising Borussia Dortmund star Erling Haalan… [+2148 chars]",2021-07-22 14:58:52.519894,-0.4995754063129425,www.football365.com,0
ng,"{'id': None, 'name': 'The Conversation Africa'}","Anna Horleston, Jessica Irving",Mars InSight: mission unveils surprising secrets of red planet's interior – new research - The Conversation UK,Mars' core is larger and less dense than we thought.,https://theconversation.com/mars-insight-mission-unveils-surprising-secrets-of-red-planets-interior-new-research-164878,https://images.theconversation.com/files/412734/original/file-20210722-25-4hl9a2.jpg?ixlib=rb-1.1.0&rect=130%2C7%2C4768%2C2380&q=45&auto=format&w=1356&h=668&fit=crop,2021-07-22T18:16:16Z,"We may have walked on the Moon and sent probes across the solar system, but we know very little about whats going on inside other planets. Now, for the first time, we have been able to view the inter… [+5946 chars]",2021-07-22 14:58:52.519894,0.002215221691131586,theconversation.com,0
ng,"{'id': None, 'name': 'Channels Television'}",,Nigeria Receives First Batch Of A-29 Super Tucano Aircraft - Channels Television,Nigeria has received the first batch of  A-29 Super Tucano Aircraft procured from the United States of America.,https://www.channelstv.com/2021/07/22/nigeria-receives-first-batch-of-a-29-super-tucano-aircraft/,https://www.channelstv.com/wp-content/uploads/2021/07/tucano-super.jpg,2021-07-22T18:00:54Z,"The arrival of the Super Tucano is a major boost to the country’s fight against insurgency.
Nigeria has received the first batch of  A-29 Super Tucano aircraft procured from the United States of Ame… [+3126 chars]",2021-07-22 14:58:52.519894,-0.17334035077095034,www.channelstv.com,1
ng,"{'id': 'the-wall-street-journal', 'name': 'The Wall Street Journal'}",Kevin Cook,The Case Against Space Tourism - The Wall Street Journal,Professional astronauts have a full understanding of the risks. Civilians like Christa McAuliffe don’t.,https://www.wsj.com/articles/blue-origin-spacex-bezos-musk-galactic-branson-tourism-space-11626968962,https://images.wsj.net/im-373017/social,2021-07-22T17:20:00Z,"Jeff Bezos Blue Origin rocket ship and Richard Bransons Virgin Galactic spaceplane performed flawlessly during brief, newsworthy flights this month that seemed fun and even inspiring. Both men hope t… [+1535 chars]",2021-07-22 14:58:52.519894,0.33303333333333335,www.wsj.com,0
ng,"{'id': 'techcrunch', 'name': 'TechCrunch'}",Manish Singh,India considering phased roll out of central bank digital currency - TechCrunch,"India’s central bank is considering launching a digital currency, according to a top executive, giving a clear indication of its intentions for the first time after previously stating that it was studying the idea. T Rabi Sankar, the deputy governor of Reserv…",http://techcrunch.com/2021/07/22/india-considering-phased-roll-out-of-central-bank-digital-currency/,https://techcrunch.com/wp-content/uploads/2020/12/GettyImages-1096026706.jpg?w=570,2021-07-22T16:42:40Z,"Indias central bank is considering launching a digital currency, according to a top executive, giving a clear indication of its intentions for the first time after previously stating that it was stud… [+3834 chars]",2021-07-22 14:58:52.519894,-0.0407306985537211,techcrunch.com,0
ng,"{'id': None, 'name': 'The Punch'}",Victoria Edeme,"Pictorial: Obi Cubana, associates, wives visit the Maldives after mother’s burial - Punch Newspapers","Chairman of Cubana Group, Obi Iyiegbu, popularly known as Obi Cubana, has hit the Maldives with his associates and their wives, following the record-breaking burial ceremony of his mother at Oba town in Anambra State.",https://punchng.com/pictorial-obi-cubana-associates-wives-visit-the-maldives-after-mothers-burial/,https://cdn.punchng.com/wp-content/uploads/2021/07/22182707/WhatsApp-Image-2021-07-22-at-5.20.51-PM.jpeg,2021-07-22T16:35:24Z,"Chairman of Cubana Group, Obi Iyiegbu, popularly known as Obi Cubana, has hit the Maldives with his associates and their wives, following the record-breaking burial ceremony of his mother at Oba town… [+821 chars]",2021-07-22 14:58:52.519894,0.49335,punchng.com,1
ng,"{'id': None, 'name': 'The Nation Newspaper '}",,APC suspends Nasarawa Commissioner - The Nation Newspaper ,The All Progressives Congress (APC) in Nasarawa Eggon local government area of Nasarawa has suspended Commissioner...,https://thenationonlineng.net/apc-suspends-nasarawa-commissioner/,https://thenationonlineng.net/wp-content/uploads/2021/04/APC.png,2021-07-22T16:09:12Z,"By Linus Oota, Lafia
The All Progressives Congress (APC) in Nasarawa Eggon local government area of Nasarawa has suspended Commissioner for Lands and Survey Dr Salihu Alizaga.
Alizaga, who hails fr… [+1462 chars]",2021-07-22 14:58:52.519894,0.0,thenationonlineng.net,1
ng,"{'id': None, 'name': 'Www.rfi.fr'}",RFI,Smith Rowe signs new long-term deal with Arsenal - RFI,,https://www.rfi.fr/en/sports/20210722-smith-rowe-signs-new-long-term-deal-with-arsenal,https://s.rfi.fr/media/display/bccf9efa-eb06-11eb-a755-005056a90284/w:1280/p:16x9/798d28daa8c40d33493afd79f786921553107837.jpg,2021-07-22T16:06:13Z,"London (AFP)
Arsenal youngster Emile Smith Rowe has signed a new long-term contract, the Premier League club announced on Thursday.
The 20-year-old youth product, who joined the club at the age of … [+728 chars]",2021-07-22 14:58:52.519894,0.9509,www.rfi.fr,0
ng,"{'id': None, 'name': 'Thecable.ng'}",by  Samuel Akpan,"COVID-19: Infections take a leap as Nigeria logs 238 cases, two deaths - TheCable",Nigeria has seen a surge in its daily coronavirus cases since the country recorded the index case of the Delta variant.Advertisement The Nigeria Centre for Disease Control (NCDC) says 238,https://www.thecable.ng/covid-19-infections-take-a-leap-as-nigeria-logs-238-cases-two-deaths,https://f5p3e9e4.stackpathcdn.com/wp-content/uploads/2020/04/coronavirus-e1622914543599.jpg,2021-07-22T12:16:00Z,"Nigeria has seen a surge in its daily coronavirus cases since the country recorded the index case of the Delta variant.
The Nigeria Centre for Disease Control (NCDC) says 238 cases were recorded in … [+997 chars]",2021-07-22 14:58:52.519894,0.0,www.thecable.ng,1
ng,"{'id': None, 'name': 'THISDAY Newspapers'}",,UNAIDS: 1.7m Children Living with HIV Missed Treatment in 2020 - THISDAY Newspapers,Female HIV infection declines By Onyebuchi Ezigbo The Joint United Nations Programme on HIV/AIDS (UNAIDS) has said that almost half of the world’s 1.7 million children living with HIV (46%) did not…,https://www.thisdaylive.com/index.php/2021/07/22/unaids-1-7m-children-living-with-hiv-missed-treatment-in-2020/,https://storage.googleapis.com/thisday-846548948316-wp-data/wp-media/c32652ea-unaids.gif,2021-07-22T11:57:34Z,"<ul><li>Female HIV infection declines</li></ul>By Onyebuchi Ezigbo
The Joint United Nations Programme on HIV/AIDS (UNAIDS) has said that almost half of the worlds 1.7 million children living with HI… [+4438 chars]",2021-07-22 14:58:52.519894,-0.49329355359077454,www.thisdaylive.com,1
ng,"{'id': 'reuters', 'name': 'Reuters'}",Reuters,"Barclays raises oil price view, sees slow grind higher in coming months - Reuters","The oil market's supply and demand dynamics point to a slow grind higher in prices over the next few months, Barclays said on Thursday, as it raised its 2021 oil price forecasts by $3-5 per barrel.",https://www.reuters.com/business/energy/barclays-raises-oil-price-view-sees-slow-grind-higher-coming-months-2021-07-22/,https://www.reuters.com/resizer/Y6LSyIlimqXUOg3AKd7-00F2VmY=/1200x628/smart/filters:quality(80)/cloudfront-us-east-2.images.arcpublishing.com/reuters/3SPUTMGY5JI4FBF5PKCFCMD4GM.jpg,2021-07-22T11:28:00Z,"A Barclays bank building is seen at Canary Wharf in London, Britain May 17, 2017. REUTERS/Stefan Wermuth/File PhotoJuly 22 (Reuters) - The oil market's supply and demand dynamics point to a slow grin… [+1918 chars]",2021-07-22 14:58:52.519894,-0.9642490148544312,www.reuters.com,0
ng,"{'id': None, 'name': 'NDTV News'}",Satvik Khare,Samsung Galaxy A51 Getting July 2021 Android Security Patch: Report - Gadgets 360,Samsung Galaxy A51 is reportedly getting the July 2021 Android security patch with an update. There are also some unknown new features and user-facing improvements with the update that is rolling out in Russia at the moment.,https://gadgets.ndtv.com/mobiles/news/samsung-a51-july-2021-android-security-patch-update-a515fxxu5eug2-galaxy-2492294,https://i.gadgets360cdn.com/large/Samsung_Galaxy_A51_back_lying_down_1580459203210.jpg,2021-07-22T10:20:12Z,Samsung Galaxy A51 is reportedly getting the July 2021 Android security patch with an update. The update has been spotted in Russia and can be expected to be rolled out to other regions soon. Accordi… [+1902 chars],2021-07-22 14:58:52.519894,-0.3295329213142395,gadgets.ndtv.com,0
