country,source,author,title,description,url,urlToImage,publishedAt,content,date,sentiment,domain,is_green
gb,"{'id': None, 'name': 'South Wales Argus'}",Iwan Gabe Davies,140mph dangerous driver told: You're no Lewis Hamilton or Max Verstappen' - South Wales Argus,A DANGEROUS driver who was speeding at 140mph on a dual carriageway was told he is no Formula 1 ace like Lewis Hamilton or Max Verstappen.,https://www.southwalesargus.co.uk/news/19461715.140mph-bmw-driver-no-lewis-hamilton-max-verstappen/,https://www.southwalesargus.co.uk/resources/images/12823664/,2021-07-22T13:14:02Z,"A DANGEROUS driver who was speeding at 140mph on a dual carriageway was told he is no Formula 1 ace like Lewis Hamilton or Max Verstappen.
Connor Bunten, 21, was slammed by a judge who told him he c… [+2405 chars]",2021-07-22 14:58:52.519894,-0.9986290037631989,www.southwalesargus.co.uk,0
gb,"{'id': 'financial-times', 'name': 'Financial Times'}",,ECB vows to persist with negative rates in bid to fuel inflation - Financial Times,Central bank holds first meeting since policy review changed strategy to become more tolerant of price growth,https://www.ft.com/content/b329cbe7-1d93-41f5-8812-297f0e03de58,https://www.ft.com/__origami/service/image/v2/images/raw/https%3A%2F%2Fd1e00ek4ebabms.cloudfront.net%2Fproduction%2F1acf1a83-d956-4578-ae26-7c870c06e730.jpg?source=next-opengraph&fit=scale-down&width=900,2021-07-22T12:46:32Z,"The European Central Bank will keep buying bonds and maintain its deeply negative interest rates in an attempt to shift the eurozone economy out of its persistent pattern of sluggish inflation, its p… [+5141 chars]",2021-07-22 14:58:52.519894,-0.003992691659927383,www.ft.com,0
gb,"{'id': None, 'name': 'Sky.com'}",Philip Whiteside,"COVID-19: Business secretary says govt 'very concerned' as more than 600,000 pinged in a week - Sky News",,https://news.sky.com/story/covid-19-business-secretary-says-govt-very-concerned-as-more-than-600-000-pinged-in-a-week-12361176,https://e3.365dm.com/21/07/1600x900/skynews-test-and-trace-nhs-app_5452825.jpg?20210720094359,2021-07-22T12:11:15Z,,2021-07-22 14:58:52.519894,-0.9602316617965698,news.sky.com,0
gb,"{'id': None, 'name': 'MyLondon'}","Hannah Kane, Ruby Gregory",Brixton stabbing: First picture of man in his early 20s stabbed to death outside London Underground station - My London,A motorbike left abandoned at the scene is believed to be the victim's,https://www.mylondon.news/news/south-london-news/brixton-stabbing-first-picture-man-21117707,https://i2-prod.mylondon.news/incoming/article21117229.ece/ALTERNATES/s1200/0_shane-1.jpg,2021-07-22T12:08:17Z,"A young man stabbed to death in Brixton has been named and pictured for the first time.
 The victim, believed to be in his early 20s, was attacked outside Brixton Underground station on Wednesday ev… [+3010 chars]",2021-07-22 14:58:52.519894,-0.9949566721916199,www.mylondon.news,0
gb,"{'id': None, 'name': 'Daily Mail'}",Ryan Morrison,Astronomers discover a moon-forming disc around a giant Jupiter-like exoplanet - Daily Mail,"The new moons were created from a dusty circle surrounding a gas giant world that is 370 light years from the Earth, explained astronomers from University of Grenoble, France.",https://www.dailymail.co.uk/sciencetech/article-9813877/Astronomers-discover-moon-forming-disc-giant-Jupiter-like-exoplanet.html,https://i.dailymail.co.uk/1s/2021/07/22/12/45759505-0-image-a-55_1626953877734.jpg,2021-07-22T12:00:49Z,"The birth of moons surrounding a distant Jupiter-like exoplanet has been observed for the first time, giving astronomers insight into early planetary systems. 
They were created from a dusty circle … [+7736 chars]",2021-07-22 14:58:52.519894,0.6913,www.dailymail.co.uk,0
gb,"{'id': None, 'name': 'Mirror Online'}",Dan Bloom,"Government giving no new money to fund NHS 3% pay rise, No10 confirms - The Mirror","No10 said the rise would come from ""within the NHS budget"" - despite pleas to ensure it doesn't come at the cost of other projects in the health service",https://www.mirror.co.uk/news/politics/breaking-government-giving-no-new-24592957,https://i2-prod.mirror.co.uk/incoming/article24584574.ece/ALTERNATES/s1200/0_Protest-for-NHS-Pay-Rise-in-London.jpg,2021-07-22T11:18:50Z,"The government will not provide any new money for the 3% NHS pay rise in England, Downing Street confirmed today.
A No10 spokesman said the £2.2bn rise would come from ""within the NHS budget"" - a mo… [+2974 chars]",2021-07-22 14:58:52.519894,-0.9510952830314636,www.mirror.co.uk,0
gb,"{'id': None, 'name': 'Sky Sports'}",,The Hundred: Sam Billings expects new generation of stars to emerge from competition - Sky Sports,Oval Invincibles captain Sam Billings believes The Hundred will propel a new generation of stars towards stardom - and tips team-mate Will Jacks to lead the charge.,https://www.skysports.com/the-hundred/news/36890/12360817/the-hundred-sam-billings-expects-new-generation-of-stars-to-emerge-from-competition,https://e0.365dm.com/21/07/1600x900/skysports-sam-billings-oval-invincibles_5454594.jpg?20210721195222,2021-07-22T11:01:26Z,,2021-07-22 14:58:52.519894,0.002018452024459827,www.skysports.com,0
gb,"{'id': None, 'name': 'Express'}",Aaron Brown,Microsoft issues warning to ALL Windows 10 users: You need to follow these steps now - Express,"MICROSOFT has issued a stark warning to Windows 10 users about a new zero-day flaw, which could allow hackers to delete or steal your personal data, create new accounts on your PC, and much more.",https://www.express.co.uk/life-style/science-technology/1466120/Microsoft-Warns-All-Windows-10-Users-Follow-These-Steps-Now,https://cdn.images.express.co.uk/img/dynamic/59/750x445/1466120.jpg,2021-07-22T10:10:00Z,"Windows 10 users have been put on high alert over a dangerous new flaw found lurking inside the popular desktop operating system. Dubbed SeriousSAM, it allows bad actors to gain administrator rights … [+1927 chars]",2021-07-22 14:58:52.519894,-0.4992850124835968,www.express.co.uk,0
gb,"{'id': None, 'name': 'Daily Mail'}",Ryan Morrison,Artist 'unwraps' a classic picture taken by Neil Armstrong on the Apollo 11 mission - Daily Mail,"To create the panorama, artist Michael Ranger, who goes by rg1213, zoomed in on the reflection of the lunar surface in Buzz Aldrin's visor and 'unwrapped it'.",https://www.dailymail.co.uk/sciencetech/article-9813601/Artist-unwraps-classic-picture-taken-Neil-Armstrong-Apollo-11-mission.html,https://i.dailymail.co.uk/1s/2021/07/22/10/45755281-0-image-a-2_1626946930577.jpg,2021-07-22T09:53:24Z,"A visual effects artist has 'unwrapped' a classic picture taken by Neil Armstrong during the Apollo 11 mission, to show what Buzz Aldrin would have seen.
The video clip, uploaded to Reddit, shows a … [+8066 chars]",2021-07-22 14:58:52.519894,-0.4796581566333771,www.dailymail.co.uk,0
gb,"{'id': None, 'name': 'Mirror Online'}",Jasmine Allday,Katie Price releasing gruesome 'raw' video of her latest cosmetic surgery overhaul - The Mirror,"Former glamour girl Katie Price, 43, is giving fans a 'raw and unfiltered' insight into her latest lot of surgery. Katie recently flew to Turkey to undergo a number of procedures including a face lift, full body liposuction, eye and lip lifts, liposuction und…",https://www.mirror.co.uk/3am/celebrity-news/katie-price-releasing-gruesome-raw-24590742,https://i2-prod.mirror.co.uk/incoming/article24590347.ece/ALTERNATES/s1200/1_Katie-Price.jpg,2021-07-22T08:17:50Z,"Katie Price is set to give fans a look at a gruesome video of her latest cosmetic surgery overhaul.
The former glamour girl, 43, recently returned from Turkey after undergoing procedures including a… [+2695 chars]",2021-07-22 14:58:52.519894,-0.32334889844258624,www.mirror.co.uk,0
gb,"{'id': None, 'name': 'Mirror Online'}",William Walker,'Young Covid patients on their death beds are begging me for the vaccine' - Scottish Daily Record,"In a frank and harrowing post on social media Dr Brytney Cobia, who works in Alabama in the United States, said she has to tell her dying patients she's sorry but 'it's too late'",https://www.mirror.co.uk/news/us-news/doctor-says-young-covid-patients-24589635,https://i2-prod.mirror.co.uk/incoming/article24589632.ece/ALTERNATES/s1200/0_A-DOCTOR-has-described-how-young-and-unvaccinated-Covid-19-patients-beg-for-the-vaccine-as-theyre.jpg,2021-07-21T23:13:00Z,"A doctor has revealed the horror of seeing young Covid patients begging her for a vaccine while they lie on their death beds.
In a frank and harrowing post on social media Dr Brytney Cobia said she … [+2281 chars]",2021-07-22 14:58:52.519894,-0.863225132226944,www.mirror.co.uk,0
gb,"{'id': 'financial-times', 'name': 'Financial Times'}",,The argument for vaccinating teens - Financial Times,A UK advisory committee’s caution jars with the government’s lack of it,https://www.ft.com/content/bddfa921-e3c8-4f43-a6f6-67608b038eaf,https://www.ft.com/__origami/service/image/v2/images/raw/https%3A%2F%2Fd1e00ek4ebabms.cloudfront.net%2Fproduction%2F87d2fe86-0cc8-4a52-a6dc-80f5ad581300.jpg?source=next-opengraph&fit=scale-down&width=900,2021-07-21T09:13:24Z,"Vaccinating children will always be an emotive and complex argument. Unlike other measures against Covid-19, such as mask wearing, it is a debate that has split the medical community. Some countries,… [+3444 chars]",2021-07-22 14:58:52.519894,0.0,www.ft.com,0
ie,"{'id': 'the-irish-times', 'name': 'The Irish Times'}",Brian Hutton,"Most Covid deaths, intensive care admissions among unvaccinated - The Irish Times",Almost six in 10 deaths in two-month period were among people who had not got vaccine,https://www.irishtimes.com/news/health/most-covid-deaths-intensive-care-admissions-among-unvaccinated-1.4628085,https://www.irishtimes.com/image-creator/?id=1.4628082&origw=1199,2021-07-22T19:28:00Z,"Most deaths and intensive-care admissions linked to Covid-19 in recent weeks have been among people who were not vaccinated, latest Health Service Executive (HSE) figures show.
Colm Henry, chief ope… [+3344 chars]",2021-07-22 14:58:52.519894,-0.49211394786834717,www.irishtimes.com,0
ie,"{'id': None, 'name': 'Independent.ie'}",Aidan Fitzmaurice,Ross Tierney goal in Luxembourg seals another great European night for Bohs - Independent.ie,ANOTHER superb away day in Europe from Dubliner Ross Tierney has given Bohemians a massive advantage in their Europa Conference League battle with Dudelange.,https://www.independent.ie/sport/soccer/league-of-ireland/ross-tierney-goalin-luxembourg-seals-another-great-european-night-for-bohs-40681259.html,https://www.independent.ie/sport/soccer/league-of-ireland/67628/40681258.ece/AUTOCROP/w1240h700/20210722_Gerry_Schmit_0001,2021-07-22T18:51:00Z,"ANOTHER superb away day in Europe from Dubliner Ross Tierney has given Bohemians a massive advantage in their Europa Conference League battle with Dudelange.
The Finglas lad scored the only goal of … [+1912 chars]",2021-07-22 14:58:52.519894,0.99905,www.independent.ie,0
ie,"{'id': None, 'name': 'TheJournal.ie'}",Rónán Duffy,Irish holidaymakers in Malta end quarantine as Embassy warns against travel without Digital Covid Cert - thejournal.ie,Malta is the only European country not accepting HSE vaccination cards as proof of vaccination.,https://www.thejournal.ie/malta-digital-covid-cert-5502600-Jul2021/,https://img2.thejournal.ie/article/5502600/river/?height=400&version=5502685,2021-07-22T18:29:00Z,"Updated 24 minutes ago
ALL OF THE holidaymakers who flew from Dublin to Malta and were forced into mandatory quarantine after their HSE vaccine cards were not accepted have now been issued with Digi… [+2979 chars]",2021-07-22 14:58:52.519894,0.25205,www.thejournal.ie,1
ie,"{'id': None, 'name': 'TheJournal.ie'}",Press Association,Northern Ireland parties divided over Westminster direction on abortion services - thejournal.ie,The North’s abortion laws were liberalised in 2019 but full services have not been commissioned due to disagreements between the Executive parties.,https://www.thejournal.ie/northern-ireland-abortion-dup-5503122-Jul2021/,https://img2.thejournal.ie/article/5503122/river/?height=400&version=5503125,2021-07-22T18:14:00Z,"THE DUP HAS said that a Westminster direction that Stormont must set up full abortion services in Northern Ireland has undermined devolution.
But Sinn Féin, the Alliance Party and Green Party have w… [+3744 chars]",2021-07-22 14:58:52.519894,-0.49654465913772583,www.thejournal.ie,1
ie,"{'id': None, 'name': 'Irish Mirror'}",Marita Moloney,Ireland weather: Met Eireann says heatwave peak is over with major change on the way - Irish Mirror,"The entire country remains under a status Yellow high-temperature warning until Saturday, but conditions are set to change in the coming days",https://www.irishmirror.ie/news/irish-news/ireland-weather-met-eireann-says-24596867,https://i2-prod.irishmirror.ie/incoming/article24596772.ece/ALTERNATES/s1200/0_CC-22ND-JULY-PORTMARNOCK-SUN1890504098.jpg,2021-07-22T18:00:21Z,"A week that will go down as one of the hottest in living memory is drawing to a close, with the Irish heatwave also coming to an end.
Temperatures almost hit 31C in some areas nationwide in recent d… [+2856 chars]",2021-07-22 14:58:52.519894,-0.9030216336250305,www.irishmirror.ie,0
ie,"{'id': None, 'name': 'TheJournal.ie'}",Jane Moore,"Coronavirus: 1,189 new cases confirmed in Ireland - thejournal.ie",Dr Ronan Glynn said there has been a “sharp increase” in the level of travel-related cases of Covid-19.,https://www.thejournal.ie/covid-19-latest-cases-ireland-5502344-Jul2021/,https://img2.thejournal.ie/article/5502344/river/?height=400&version=5503057,2021-07-22T16:34:00Z,"PUBLIC HEALTH OFFICIALS have confirmed 1,189 new cases of Covid-19 in Ireland.
The Department of Health has reported that 95 patients with the coronavirus disease are in hospital today, including 23… [+1354 chars]",2021-07-22 14:58:52.519894,0.05236296114921568,www.thejournal.ie,1
ie,"{'id': None, 'name': 'Irish Mirror'}",David Kent,RTE star Joe Duffy asked if he's 'a big fat s***e' by Liveline caller in mad row - Irish Mirror,"The show kicked off on Thursday with Joe at the helm, having returned from a holiday at the start of the week",https://www.irishmirror.ie/news/irish-news/rte-star-joe-duffy-asked-24596057,https://i2-prod.irishmirror.ie/tv/article22017562.ece/ALTERNATES/s1200/1_joe-duffyjpeg.jpg,2021-07-22T16:02:01Z,"RTE star Joe Duffy was asked if he is a ""big fat s***e"" by an angry Liveline caller after a discussion involving the Great Famine, Eamonn Holmes and Tina Turner took a bizarre turn.
The show kicked … [+2510 chars]",2021-07-22 14:58:52.519894,-0.4974822998046875,www.irishmirror.ie,0
ie,"{'id': 'the-irish-times', 'name': 'The Irish Times'}",Vivienne Clarke,Staff should name and shame employers making it difficult to get vaccinated – Varadkar - The Irish Times,Tánaiste calls on bosses to ‘have a heart’ and give workers time to get their jabs,https://www.irishtimes.com/news/ireland/irish-news/staff-should-name-and-shame-employers-making-it-difficult-to-get-vaccinated-varadkar-1.4627660,https://www.irishtimes.com/polopoly_fs/1.4627659.1626957142!/image/image.jpg,2021-07-22T15:56:15Z,"Tánaiste Leo Varadkar has called on staff to name and shame any employers who are making it difficult for them to take time off to get vaccinated.
Speaking on Newstalks Pat Kenny show, Mr Varadkar u… [+2569 chars]",2021-07-22 14:58:52.519894,-0.4989941418170929,www.irishtimes.com,0
ie,"{'id': None, 'name': 'Kildare-nationalist.ie'}",Kildare Nationalist Reporter,Paul Reid: 'There's one big hurdle in our way and that's the Delta variant' - Kildare Nationalist,The HSE chief executive said the public can approach the threat with a level of confidence that stems from the vaccination programme…,https://kildare-nationalist.ie/2021/07/22/paul-reid-theres-one-big-hurdle-in-our-way-and-thats-the-delta-variant/,https://kildare-nationalist.ie/wp-content/uploads/2019/06/cropped-share-kildare.jpg,2021-07-22T15:51:58Z,"By Cate McCurry, PA
The threat of the Delta variant is one “big hurdle” the country has to overcome in its battle against Covid-19, according to the chief executive of the HSE.
Paul Reid said the p… [+3461 chars]",2021-07-22 14:58:52.519894,0.006327980613708484,kildare-nationalist.ie,1
ie,"{'id': None, 'name': 'Sundayworld.com'}",Liam Cosgrove,Young Co Cavan mother who died while trying to save son from drowning named as Natasha Core - Sunday World,A young mother of two died while trying to save her own son from drowning in Co Cavan last night.,https://www.sundayworld.com/news/irish-news/young-co-cavan-mother-who-died-while-trying-to-save-son-from-drowning-named-as-natasha-core-40680627.html,https://www.sundayworld.com/incoming/24a05/40680635.ece/AUTOCROP/w1240h700/Natasha%20Core%20RIP.JPG,2021-07-22T15:44:41Z,"A young mother of two died while trying to save her own son from drowning in Co Cavan last night.
The young woman, who has been named locally as Natasha Core and who was aged in her late 20s, jumped… [+1604 chars]",2021-07-22 14:58:52.519894,-0.18848635683059695,www.sundayworld.com,0
ie,"{'id': None, 'name': 'Independent.ie'}",Hugh O'Connell,Government's major plan to tackle housing crisis delayed - Independent.ie,"The Government&rsquo;s major plan to tackle the housing crisis is to be delayed, possibly until September.",https://www.independent.ie/irish-news/governments-major-plan-to-tackle-housing-crisis-delayed-40680675.html,https://www.independent.ie/irish-news/ee0a8/40680674.ece/AUTOCROP/w1240h700/Darragh%20OBrien.jpg,2021-07-22T15:43:00Z,"The Governments major plan to tackle the housing crisis is to be delayed, possibly until September.
Housing Minister Darragh OBrien had hoped to publish the Housing for All plan next Tuesday, but a … [+1406 chars]",2021-07-22 14:58:52.519894,-0.9900617897510529,www.independent.ie,0
ie,"{'id': None, 'name': 'Nature.com'}",,Highly accurate protein structure prediction for the human proteome - Nature.com,&lt;ArticleTitle Language=&quot;En&quot; xml:lang=&quot;en&quot;&gt;Highly accurate protein structure prediction for the human proteome&lt;/ArticleTitle&gt;,https://www.nature.com/articles/s41586-021-03828-1,,2021-07-22T15:03:32Z,"DeepMind, London, UK
Kathryn Tunyasuvunakool, Jonas Adler, Zachary Wu, Tim Green, Michal Zielinski, Augustin ídek, Alex Bridgland, Andrew Cowie, Clemens Meyer, Agata Laydon, Richard Evans, Alexander… [+297 chars]",2021-07-22 14:58:52.519894,0.99125,www.nature.com,0
ie,"{'id': None, 'name': 'BreakingNews.ie'}",Kenneth Fox,Donegal test centre sees swab positivity rate of 28% - BreakingNews.ie,"Meanwhile, walk-in centres in Tullamore and Limerick also saw high positivity rates, at 22 per cent and 16.7 per cent respectively.",https://www.breakingnews.ie/ireland/donegal-test-centre-sees-swab-positivity-rate-of-28-1161572.html,https://img.resized.co/breaking-news/eyJkYXRhIjoie1widXJsXCI6XCJodHRwczpcXFwvXFxcL2ltYWdlcy5icmVha2luZ25ld3MuaWVcXFwvcHJvZFxcXC91cGxvYWRzXFxcLzIwMjFcXFwvMDdcXFwvMTcxNTMxMTNcXFwvR2V0dHlJbWFnZXMtMTIzMTkyNTcxNS5qcGdcIixcIndpZHRoXCI6MTIwMCxcImhlaWdodFwiOjYyNyxcImRlZmF1bHRcIjpcImh0dHBzOlxcXC9cXFwvd3d3LmJyZWFraW5nbmV3cy5pZVxcXC9pbWFnZXNcXFwvbm8taW1hZ2UucG5nXCIsXCJvcHRpb25zXCI6W119IiwiaGFzaCI6IjNmMjIwMjEwZWFmNzg5NTBkMDgwMWQzMmQ2M2Q1YmM2ZjI4NmRiYzYifQ==/donegal-test-centre-sees-swab-positivity-rate-of-28.jpg,2021-07-22T14:50:06Z,"A Donegal Covid-19 test centre has seen a swab positivity rate of 28 per cent, which is one of the highest rates in the country.
Speaking to Newstalk, Dr Denis McCauley a GP from Buncrana said it wa… [+2105 chars]",2021-07-22 14:58:52.519894,0.4794,www.breakingnews.ie,1
ie,"{'id': None, 'name': 'BreakingNews.ie'}",Michael McAleer,What is ‘negging’? The worrying dating trend and its impact on Love Island - BreakingNews.ie,It’s an unpleasant experience many single people will relate to,https://www.breakingnews.ie/lifestyle/what-is-negging-the-worrying-dating-trend-and-its-impact-on-love-island-1161556.html,https://img.resized.co/breaking-news/eyJkYXRhIjoie1widXJsXCI6XCJodHRwczpcXFwvXFxcL2ltYWdlcy5icmVha2luZ25ld3MuaWVcXFwvcHJvZFxcXC91cGxvYWRzXFxcLzIwMjFcXFwvMDdcXFwvMjIxNDUzMTdcXFwvYzVhOTVhM2UtMDZlMi00OWYyLWE4ZTgtNDk5YTgyODVkYjU2LmpwZ1wiLFwid2lkdGhcIjoxMjAwLFwiaGVpZ2h0XCI6NjI3LFwiZGVmYXVsdFwiOlwiaHR0cHM6XFxcL1xcXC93d3cuYnJlYWtpbmduZXdzLmllXFxcL2ltYWdlc1xcXC9uby1pbWFnZS5wbmdcIixcIm9wdGlvbnNcIjpbXX0iLCJoYXNoIjoiYTA4NWE2NzE1MzQyMTBmZGNhZTA1YzVmN2RhZWRhMTJiZTlkNWZiYyJ9/what-is-negging-the-worrying-dating-trend-and-its-impact-on-love-island.jpg,2021-07-22T13:55:33Z,"Thanks to the rise of dating apps and swiping right, theres now a whole glossary of toxic dating terms that single people need to know and avoid.
As if ghosting, love-bombing and breadcrumbing weren… [+3403 chars]",2021-07-22 14:58:52.519894,-0.04039890985488892,www.breakingnews.ie,1
ie,"{'id': 'the-irish-times', 'name': 'The Irish Times'}",The Irish Times,Brexit: EU chief rejects Johnson’s plea to renegotiate Northern Ireland protocol - The Irish Times,"Brussels will be ‘flexible’ over deal but ‘will not renegotiate’, says Ursula von der Leyen",https://www.irishtimes.com/news/world/europe/brexit-eu-chief-rejects-johnson-s-plea-to-renegotiate-northern-ireland-protocol-1.4627717,https://www.irishtimes.com/image-creator/?id=1.4627716&origw=1440,2021-07-22T13:18:42Z,"European Union chief Ursula von der Leyen has rejected Boris Johnsons plea to renegotiate the post-Brexit deal on Northern Ireland after a phone call with the prime minister.
The European Commission… [+1459 chars]",2021-07-22 14:58:52.519894,0.0,www.irishtimes.com,0
ie,"{'id': 'the-irish-times', 'name': 'The Irish Times'}",The Irish Times,Father who raped his daughter after blackmailing her is jailed for 17 years - The Irish Times,David Masterson (56) sent fake text messages demanding girl engage in sexual acts,https://www.irishtimes.com/news/crime-and-law/courts/criminal-court/father-who-raped-his-daughter-after-blackmailing-her-is-jailed-for-17-years-1.4627664,https://www.irishtimes.com/image-creator/?id=1.4627697&origw=1440,2021-07-22T12:33:45Z,"A man who sexually abused his daughter over a 7½ year period after first blackmailing her has been jailed for 17 years.
David Masterson (56) sent text messages under the guise of being another perso… [+5894 chars]",2021-07-22 14:58:52.519894,-0.49857205152511597,www.irishtimes.com,0
ie,"{'id': None, 'name': 'TheJournal.ie'}",John Fallon,"'Golfgate' case against current TD, former senator and two hoteliers is adjourned to October - TheJournal.ie",The court was told the case could take three days if it goes to a full hearing.,https://www.thejournal.ie/golfgate-clifden-5502520-Jul2021/,https://img2.thejournal.ie/article/5502520/river/?height=400&version=5502522,2021-07-22T11:32:00Z,THE CASE AGAINST two prominent politicians and two hoteliers over their alleged role in organising a controversial golf dinner during Covid-19 restrictions last summer has been adjourned until Octobe… [+2747 chars],2021-07-22 14:58:52.519894,-0.9879215955734253,www.thejournal.ie,1
ie,"{'id': None, 'name': 'Independent.ie'}",Jon Ihle,Former Davy boss to reap €79m as Bank of Ireland sale heralds return of banker bonuses - Independent.ie,The former Davy CEO who was forced to resign over his role in a bond trading scandal at the firm is set to get paid nearly €79m for his stake in the stockbroker as it is sold to Bank of Ireland.,https://www.independent.ie/business/irish/former-davy-boss-to-reap79m-as-bank-of-ireland-sale-heraldsreturn-of-banker-bonuses-40679538.html,https://www.independent.ie/business/irish/a15b1/40679537.ece/AUTOCROP/w1240h700/91Davy%20Corporate%20po,2021-07-22T10:52:00Z,"The former Davy CEO who was forced to resign over his role in a bond trading scandal at the firm is set to get paid nearly 79m for his stake in the stockbroker as it is sold to Bank of Ireland.
The … [+3164 chars]",2021-07-22 14:58:52.519894,-0.4966334402561188,www.independent.ie,0
ie,"{'id': 'the-irish-times', 'name': 'The Irish Times'}",Sarah Burns,Gardaí issue warning to public about recent spate of ‘smishing’ scams - The Irish Times,Fraudsters will pretend to be from a bank and seek people’s personal information,https://www.irishtimes.com/news/crime-and-law/garda%C3%AD-issue-warning-to-public-about-recent-spate-of-smishing-scams-1.4627533,https://www.irishtimes.com/image-creator/?id=1.4627532&origw=786,2021-07-22T08:26:46Z,"Gardaí are warning the public about a recent smishing scam whereby people are receiving text messages from fraudsters purporting to be from Permanent TSB. 
The text message says there has been unusu… [+1654 chars]",2021-07-22 14:58:52.519894,-0.9945458471775055,www.irishtimes.com,0
ie,"{'id': None, 'name': 'Independent.ie'}",Sheena McGinley,Love Island Episode 21: Toby gives Chloe a taste of that proverbial medicine - Independent.ie,It's becoming increasingly clear why Toby hasn't had a &quot;serious&quot; relationship as yet. Man's not got two brain cells to rub together. But first...,https://www.independent.ie/entertainment/television/tv-news/love-island-episode-21-toby-gives-chloe-a-taste-of-that-proverbial-medicine-40678899.html,https://www.independent.ie/entertainment/television/tv-news/c1290/40678898.ece/AUTOCROP/w1240h700/ITV%20Plc,2021-07-22T05:52:00Z,"It's becoming increasingly clear why Toby hasn't had a ""serious"" relationship as yet. Man's not got two brain cells to rub together. But first...
All the boys gathered together to decide who to dump… [+3455 chars]",2021-07-22 14:58:52.519894,0.22963877408504485,www.independent.ie,0
